"path","mbti_type","variant","archetype","section_count","faq_count","internal_link_count","gsc_evidence_status","direct_answer"
"/zh/personality/infj-a","INFJ","A","提倡者","9","6","5","external_evidence_pending","INFJ-A 是 提倡者 型 INFJ 的 坚定型表达。它更常围绕意义建构、关系洞察和价值导向展开；在反馈与压力下，更容易在反馈后恢复判断，并用可行版本继续推进。这是一种用于自我观察、沟通和成长复盘的偏好语言，不用于诊断、招聘筛选或替代具体选择。"
"/zh/personality/infj-t","INFJ","T","提倡者","9","6","5","external_evidence_pending","INFJ-T 是 提倡者 型 INFJ 的 谨慎型表达。它更常围绕意义建构、关系洞察和价值导向展开；在反馈与压力下，更容易在反馈和压力下追加复盘、修正与风险检查。这是一种用于自我观察、沟通和成长复盘的偏好语言，不用于诊断、招聘筛选或替代具体选择。"
"/zh/personality/infp-a","INFP","A","调停者","9","6","5","external_evidence_pending","INFP-A 是 调停者 型 INFP 的 坚定型表达。它更常围绕内在价值、想象力和真实表达展开；在反馈与压力下，更容易在反馈后恢复判断，并用可行版本继续推进。这是一种用于自我观察、沟通和成长复盘的偏好语言，不用于诊断、招聘筛选或替代具体选择。"
"/zh/personality/infp-t","INFP","T","调停者","9","6","5","external_evidence_pending","INFP-T 是 调停者 型 INFP 的 谨慎型表达。它更常围绕内在价值、想象力和真实表达展开；在反馈与压力下，更容易在反馈和压力下追加复盘、修正与风险检查。这是一种用于自我观察、沟通和成长复盘的偏好语言，不用于诊断、招聘筛选或替代具体选择。"
"/zh/personality/enfj-a","ENFJ","A","主人公","9","6","5","external_evidence_pending","ENFJ-A 是 主人公 型 ENFJ 的 坚定型表达。它更常围绕人际带动、共同方向和支持行动展开；在反馈与压力下，更容易在反馈后恢复判断，并用可行版本继续推进。这是一种用于自我观察、沟通和成长复盘的偏好语言，不用于诊断、招聘筛选或替代具体选择。"
"/zh/personality/enfj-t","ENFJ","T","主人公","9","6","5","external_evidence_pending","ENFJ-T 是 主人公 型 ENFJ 的 谨慎型表达。它更常围绕人际带动、共同方向和支持行动展开；在反馈与压力下，更容易在反馈和压力下追加复盘、修正与风险检查。这是一种用于自我观察、沟通和成长复盘的偏好语言，不用于诊断、招聘筛选或替代具体选择。"
"/zh/personality/enfp-a","ENFP","A","竞选者","9","6","5","external_evidence_pending","ENFP-A 是 竞选者 型 ENFP 的 坚定型表达。它更常围绕可能性连接、价值驱动和创意动能展开；在反馈与压力下，更容易在反馈后恢复判断，并用可行版本继续推进。这是一种用于自我观察、沟通和成长复盘的偏好语言，不用于诊断、招聘筛选或替代具体选择。"
"/zh/personality/enfp-t","ENFP","T","竞选者","9","6","5","external_evidence_pending","ENFP-T 是 竞选者 型 ENFP 的 谨慎型表达。它更常围绕可能性连接、价值驱动和创意动能展开；在反馈与压力下，更容易在反馈和压力下追加复盘、修正与风险检查。这是一种用于自我观察、沟通和成长复盘的偏好语言，不用于诊断、招聘筛选或替代具体选择。"
